{
  "schemaVersion": 2,
  "id": "plugin-log",
  "title": "Install and use the log plugin",
  "steps": [
    {
      "id": "add-cargo-dep",
      "task": "Add the tauri-plugin-log crate to the Rust backend's dependencies in `src-tauri/Cargo.toml`.\n",
      "mutations": [
        {
          "command": "cargo add tauri-plugin-log",
          "cwd": "src-tauri"
        }
      ],
      "preconditions": [],
      "assertions": []
    },
    {
      "id": "register-plugin",
      "task": "Register the log plugin with the app builder in `lib.rs`. The scaffold's `greet` command must keep working.\n",
      "mutations": [
        {
          "file": "src-tauri/src/lib.rs",
          "diff": "--- a/src-tauri/src/lib.rs\n+++ b/src-tauri/src/lib.rs\n@@ -8,6 +8,7 @@\n pub fn run() {\n     tauri::Builder::default()\n         .plugin(tauri_plugin_opener::init())\n+        .plugin(tauri_plugin_log::Builder::new().build())\n         .invoke_handler(tauri::generate_handler![greet])\n         .run(tauri::generate_context!())\n         .expect(\"error while running tauri application\");\n"
        }
      ],
      "preconditions": [],
      "assertions": [
        {
          "kind": "ipc-local",
          "command": "greet",
          "status": "pass"
        }
      ]
    },
    {
      "id": "add-js-bindings",
      "task": "Install the JavaScript guest bindings package with the project's package manager.\n",
      "mutations": [
        {
          "command": "pnpm add @tauri-apps/plugin-log",
          "cwd": "."
        }
      ],
      "preconditions": [],
      "assertions": []
    },
    {
      "id": "usage-js",
      "task": "Produce log records from the frontend with the plugin's `trace`, `info` and `error` APIs. The TypeScript build must stay green.\n",
      "mutations": [
        {
          "file": "src/main.ts",
          "diff": "--- a/src/main.ts\n+++ b/src/main.ts\n@@ -1,4 +1,5 @@\n import { invoke } from \"@tauri-apps/api/core\";\n+import { trace, info, error } from \"@tauri-apps/plugin-log\";\n \n let greetInputEl: HTMLInputElement | null;\n let greetMsgEl: HTMLElement | null;\n@@ -19,4 +20,8 @@\n     e.preventDefault();\n     greet();\n   });\n+\n+  trace(\"Trace\");\n+  info(\"Info\");\n+  error(\"Error\");\n });\n"
        }
      ],
      "preconditions": [],
      "assertions": [
        {
          "kind": "shell",
          "run": "pnpm build",
          "status": "pass"
        }
      ]
    },
    {
      "id": "permissions",
      "task": "Let the frontend log: the log command must be denied before the capability grants the permission and succeed after.\n",
      "mutations": [
        {
          "file": "src-tauri/capabilities/default.json",
          "diff": "--- a/src-tauri/capabilities/default.json\n+++ b/src-tauri/capabilities/default.json\n@@ -5,6 +5,7 @@\n   \"windows\": [\"main\"],\n   \"permissions\": [\n     \"core:default\",\n-    \"opener:default\"\n+    \"opener:default\",\n+    \"log:default\"\n   ]\n }\n"
        }
      ],
      "preconditions": [
        {
          "kind": "ipc-acl",
          "command": "plugin:log|log",
          "status": "pass"
        }
      ],
      "assertions": [
        {
          "kind": "ipc-acl",
          "command": "plugin:log|log",
          "status": "pass"
        }
      ]
    }
  ]
}
