{
  "schemaVersion": 2,
  "id": "plugin-store",
  "title": "Install and use the store plugin",
  "steps": [
    {
      "id": "add-cargo-dep",
      "task": "Add the tauri-plugin-store crate to the Rust backend's dependencies in `src-tauri/Cargo.toml`.\n",
      "mutations": [
        {
          "command": "cargo add tauri-plugin-store",
          "cwd": "src-tauri"
        }
      ],
      "preconditions": [],
      "assertions": []
    },
    {
      "id": "register-plugin",
      "task": "Register the store plugin with the app builder in `lib.rs`. The scaffold's `greet` command must keep working.\n",
      "mutations": [
        {
          "file": "src-tauri/src/lib.rs",
          "diff": "--- a/src-tauri/src/lib.rs\n+++ b/src-tauri/src/lib.rs\n@@ -8,6 +8,7 @@\n pub fn run() {\n     tauri::Builder::default()\n         .plugin(tauri_plugin_opener::init())\n+        .plugin(tauri_plugin_store::Builder::default().build())\n         .invoke_handler(tauri::generate_handler![greet])\n         .run(tauri::generate_context!())\n         .expect(\"error while running tauri application\");\n"
        }
      ],
      "preconditions": [],
      "assertions": [
        {
          "kind": "ipc-local",
          "command": "greet",
          "status": "pass"
        }
      ]
    },
    {
      "id": "add-js-bindings",
      "task": "Install the JavaScript guest bindings package with the project's package manager, then make sure the frontend still builds.\n",
      "mutations": [
        {
          "command": "pnpm add @tauri-apps/plugin-store",
          "cwd": "."
        }
      ],
      "preconditions": [],
      "assertions": [
        {
          "kind": "shell",
          "run": "pnpm build",
          "status": "pass"
        }
      ]
    },
    {
      "id": "usage-js",
      "task": "From the frontend, load a store called `store.json`, set a key, read it back and save the store. The TypeScript build must stay green.\n",
      "mutations": [
        {
          "file": "src/main.ts",
          "diff": "--- a/src/main.ts\n+++ b/src/main.ts\n@@ -1,4 +1,5 @@\n import { invoke } from \"@tauri-apps/api/core\";\n+import { load } from \"@tauri-apps/plugin-store\";\n \n let greetInputEl: HTMLInputElement | null;\n let greetMsgEl: HTMLElement | null;\n@@ -12,11 +13,26 @@\n   }\n }\n \n-window.addEventListener(\"DOMContentLoaded\", () => {\n+window.addEventListener(\"DOMContentLoaded\", async () => {\n   greetInputEl = document.querySelector(\"#greet-input\");\n   greetMsgEl = document.querySelector(\"#greet-msg\");\n   document.querySelector(\"#greet-form\")?.addEventListener(\"submit\", (e) => {\n     e.preventDefault();\n     greet();\n   });\n+\n+  // Create a new store or load the existing one; the options are ignored if\n+  // a `Store` with that path has already been created\n+  const store = await load(\"store.json\", { autoSave: false });\n+\n+  // Set a value.\n+  await store.set(\"some-key\", { value: 5 });\n+\n+  // Get a value.\n+  const val = await store.get<{ value: number }>(\"some-key\");\n+  console.log(val); // { value: 5 }\n+\n+  // You can manually save the store after making changes.\n+  // Otherwise, it will save upon graceful exit as described above.\n+  await store.save();\n });\n"
        }
      ],
      "preconditions": [],
      "assertions": [
        {
          "kind": "shell",
          "run": "pnpm build",
          "status": "pass"
        }
      ]
    },
    {
      "id": "usage-rust",
      "task": "Use the store from Rust in the app's setup hook: load `store.json`, set a key, read it back and release the resource.\n",
      "mutations": [
        {
          "file": "src-tauri/src/lib.rs",
          "diff": "--- a/src-tauri/src/lib.rs\n+++ b/src-tauri/src/lib.rs\n@@ -1,3 +1,6 @@\n+use serde_json::json;\n+use tauri_plugin_store::StoreExt;\n+\n // Learn more about Tauri commands at https://tauri.app/develop/calling-rust/\n #[tauri::command]\n fn greet(name: &str) -> String {\n@@ -10,6 +13,25 @@\n         .plugin(tauri_plugin_opener::init())\n         .plugin(tauri_plugin_store::Builder::default().build())\n         .invoke_handler(tauri::generate_handler![greet])\n+        .setup(|app| {\n+            // Create a new store or load the existing one; this also puts the\n+            // store in the app's resource table so later `store` calls (from\n+            // both Rust and JS) reuse the same store.\n+            let store = app.store(\"store.json\")?;\n+\n+            // Note that values must be serde_json::Value instances, otherwise\n+            // they are not compatible with the JavaScript bindings.\n+            store.set(\"some-key\", json!({ \"value\": 5 }));\n+\n+            // Get a value from the store.\n+            let value = store.get(\"some-key\").expect(\"Failed to get value from store\");\n+            println!(\"{}\", value); // {\"value\":5}\n+\n+            // Remove the store from the resource table.\n+            store.close_resource();\n+\n+            Ok(())\n+        })\n         .run(tauri::generate_context!())\n         .expect(\"error while running tauri application\");\n }\n"
        }
      ],
      "preconditions": [],
      "assertions": [
        {
          "kind": "ipc-local",
          "command": "greet",
          "status": "pass"
        }
      ]
    },
    {
      "id": "permissions",
      "task": "Let the frontend use the store: loading a store from the webview must be denied before the capability grants the store permissions and succeed after.\n",
      "mutations": [
        {
          "file": "src-tauri/capabilities/default.json",
          "diff": "--- a/src-tauri/capabilities/default.json\n+++ b/src-tauri/capabilities/default.json\n@@ -5,6 +5,7 @@\n   \"windows\": [\"main\"],\n   \"permissions\": [\n     \"core:default\",\n-    \"opener:default\"\n+    \"opener:default\",\n+    \"store:default\"\n   ]\n }\n"
        }
      ],
      "preconditions": [
        {
          "kind": "ipc-acl",
          "command": "plugin:store|load",
          "status": "pass"
        }
      ],
      "assertions": [
        {
          "kind": "ipc-acl",
          "command": "plugin:store|load",
          "status": "pass"
        }
      ]
    }
  ]
}
