{
  "schemaVersion": 1,
  "id": "rsbuild",
  "title": "Use Rsbuild as the frontend build tool",
  "advisory": false,
  "platform": "linux",
  "steps": [
    {
      "id": "switch-to-rsbuild",
      "task": "Replace Vite with Rsbuild: point the package.json scripts at rsbuild, swap the devDependency, and add rsbuild.config.ts. The scaffold keeps its entry in `src/main.ts` and its own `index.html`, so tell Rsbuild about both — and let it inject the bundle script instead of the hardcoded Vite tags.\n",
      "mutations": [
        {
          "file": "index.html",
          "diff": "--- a/index.html\n+++ b/index.html\n@@ -2,10 +2,8 @@\n <html lang=\"en\">\n   <head>\n     <meta charset=\"UTF-8\" />\n-    <link rel=\"stylesheet\" href=\"/src/styles.css\" />\n     <meta name=\"viewport\" content=\"width=device-width, initial-scale=1.0\" />\n     <title>Tauri App</title>\n-    <script type=\"module\" src=\"/src/main.ts\" defer></script>\n   </head>\n \n   <body>\n"
        },
        {
          "file": "package.json",
          "diff": "--- a/package.json\n+++ b/package.json\n@@ -4,9 +4,9 @@\n   \"version\": \"0.1.0\",\n   \"type\": \"module\",\n   \"scripts\": {\n-    \"dev\": \"vite\",\n-    \"build\": \"tsc && vite build\",\n-    \"preview\": \"vite preview\",\n+    \"dev\": \"rsbuild dev\",\n+    \"build\": \"rsbuild build\",\n+    \"preview\": \"rsbuild preview\",\n     \"tauri\": \"tauri\"\n   },\n   \"dependencies\": {\n@@ -15,7 +15,7 @@\n   },\n   \"devDependencies\": {\n     \"@tauri-apps/cli\": \"^2\",\n-\t\t\"vite\": \"^8.0.16\",\n+    \"@rsbuild/core\": \"^1.6.12\",\n     \"typescript\": \"~6.0.3\"\n   }\n }\n"
        },
        {
          "file": "rsbuild.config.ts",
          "diff": "new file: rsbuild.config.ts\n+import { defineConfig } from \"@rsbuild/core\";\n+\n+const host = process.env.TAURI_DEV_HOST;\n+\n+// Docs: https://rsbuild.rs/config/\n+export default defineConfig({\n+  source: {\n+    // create-tauri-app keeps the entry in src/, not rsbuild's default location\n+    entry: { index: \"./src/main.ts\" },\n+  },\n+  html: {\n+    // reuse the scaffold's page; rsbuild injects the bundle script itself\n+    template: \"./index.html\",\n+  },\n+  server: {\n+    // Tauri expects a fixed port, fail if that port is not available\n+    strictPort: true,\n+    // if the host Tauri is expecting is set, use it\n+    host: host || undefined,\n+  },\n+  dev: {\n+    client: host\n+      ? {\n+          protocol: \"ws\",\n+          host,\n+          port: 1421,\n+        }\n+      : undefined,\n+  },\n+  output: {\n+    // don't minify for debug builds\n+    minify: !process.env.TAURI_ENV_DEBUG,\n+    // produce sourcemaps for debug builds\n+    sourceMap: !!process.env.TAURI_ENV_DEBUG,\n+  },\n+  tools: {\n+    rspack: {\n+      watchOptions: {\n+        // .git and node_modules are ignored by rsbuild by default\n+        // src-tauri usually does not contain frontend files so it's ignored here as well\n+        ignored: [\"**/.git\", \"**/node_modules\", \"**/src-tauri/**\"],\n+      },\n+    },\n+  },\n+});\n+"
        },
        {
          "file": "src/main.ts",
          "diff": "--- a/src/main.ts\n+++ b/src/main.ts\n@@ -1,4 +1,5 @@\n import { invoke } from \"@tauri-apps/api/core\";\n+import \"./styles.css\";\n \n let greetInputEl: HTMLInputElement | null;\n let greetMsgEl: HTMLElement | null;\n"
        }
      ],
      "preconditions": [],
      "assertions": [
        {
          "kind": "shell",
          "run": "pnpm install --no-frozen-lockfile && pnpm build",
          "status": "pass"
        },
        {
          "kind": "shell",
          "run": "node -e \"process.exit(require('fs').existsSync('dist/index.html') ? 0 : 1)\"",
          "status": "pass"
        }
      ]
    },
    {
      "id": "wire-tauri-config",
      "task": "Point Tauri at the Rsbuild dev server and hooks: `pnpm dev` / `pnpm build` as the before-commands, Rsbuild's default port 3000 as `devUrl`, and `../dist` as `frontendDist`. The app's IPC must keep working with the new configuration.\n",
      "mutations": [
        {
          "file": "src-tauri/tauri.conf.json",
          "diff": "--- a/src-tauri/tauri.conf.json\n+++ b/src-tauri/tauri.conf.json\n@@ -5,7 +5,7 @@\n   \"identifier\": \"com.tatu.rsbuild\",\n   \"build\": {\n     \"beforeDevCommand\": \"pnpm dev\",\n-    \"devUrl\": \"http://localhost:1420\",\n+    \"devUrl\": \"http://localhost:3000\",\n     \"beforeBuildCommand\": \"pnpm build\",\n     \"frontendDist\": \"../dist\"\n   },\n"
        }
      ],
      "preconditions": [],
      "assertions": [
        {
          "kind": "ipc-local",
          "command": "greet",
          "status": "pass"
        }
      ]
    }
  ]
}
