{
  "schemaVersion": 1,
  "id": "greet-command",
  "title": "Call a Rust command and read a file with the fs plugin",
  "advisory": false,
  "platform": "linux",
  "steps": [
    {
      "id": "verify-greet",
      "task": "Confirm the scaffold's `greet` command answers over IPC: invoking `greet` with the name \"Tauri\" returns the greeting string.\n",
      "mutations": [],
      "preconditions": [],
      "assertions": [
        {
          "kind": "ipc-local",
          "command": "greet",
          "status": "pass"
        }
      ]
    },
    {
      "id": "add-fs-plugin",
      "task": "Add the tauri-plugin-fs dependency to the Rust backend and register the plugin with the app builder. The greet command must keep working.\n",
      "mutations": [
        {
          "file": "src-tauri/Cargo.toml",
          "diff": "--- a/src-tauri/Cargo.toml\n+++ b/src-tauri/Cargo.toml\n@@ -20,6 +20,7 @@\n [dependencies]\n tauri = { version = \"2\", features = [] }\n tauri-plugin-opener = \"2\"\n+tauri-plugin-fs = \"2\"\n serde = { version = \"1\", features = [\"derive\"] }\n serde_json = \"1\"\n \n"
        },
        {
          "file": "src-tauri/src/lib.rs",
          "diff": "--- a/src-tauri/src/lib.rs\n+++ b/src-tauri/src/lib.rs\n@@ -8,6 +8,7 @@\n pub fn run() {\n     tauri::Builder::default()\n         .plugin(tauri_plugin_opener::init())\n+        .plugin(tauri_plugin_fs::init())\n         .invoke_handler(tauri::generate_handler![greet])\n         .run(tauri::generate_context!())\n         .expect(\"error while running tauri application\");\n"
        }
      ],
      "preconditions": [],
      "assertions": [
        {
          "kind": "ipc-local",
          "command": "greet",
          "status": "pass"
        }
      ]
    },
    {
      "id": "grant-fs-permission",
      "task": "Let the frontend read files from the app's data directory using the fs plugin. Reading must fail before the capability is granted and succeed after.\n",
      "mutations": [
        {
          "file": "src-tauri/capabilities/default.json",
          "diff": "--- a/src-tauri/capabilities/default.json\n+++ b/src-tauri/capabilities/default.json\n@@ -2,9 +2,13 @@\n   \"$schema\": \"../gen/schemas/desktop-schema.json\",\n   \"identifier\": \"default\",\n   \"description\": \"Capability for the main window\",\n-  \"windows\": [\"main\"],\n+  \"windows\": [\n+    \"main\"\n+  ],\n   \"permissions\": [\n     \"core:default\",\n-    \"opener:default\"\n+    \"opener:default\",\n+    \"fs:default\",\n+    \"fs:allow-appdata-read-recursive\"\n   ]\n }\n"
        }
      ],
      "preconditions": [
        {
          "kind": "ipc-acl",
          "command": "plugin:fs|read_text_file",
          "status": "pass"
        }
      ],
      "assertions": [
        {
          "kind": "ipc-acl",
          "command": "plugin:fs|read_text_file",
          "status": "pass"
        }
      ]
    }
  ]
}
