{
  "schemaVersion": 2,
  "id": "plugin-sql",
  "title": "Install and use the sql plugin (SQLite)",
  "steps": [
    {
      "id": "add-cargo-dep",
      "task": "Add the tauri-plugin-sql crate to the Rust backend's dependencies in `src-tauri/Cargo.toml`.\n",
      "mutations": [
        {
          "command": "cargo add tauri-plugin-sql",
          "cwd": "src-tauri"
        }
      ],
      "preconditions": [],
      "assertions": []
    },
    {
      "id": "register-plugin",
      "task": "Register the sql plugin with the app builder in `lib.rs`.\n",
      "mutations": [
        {
          "file": "src-tauri/src/lib.rs",
          "diff": "--- a/src-tauri/src/lib.rs\n+++ b/src-tauri/src/lib.rs\n@@ -8,6 +8,7 @@\n pub fn run() {\n     tauri::Builder::default()\n         .plugin(tauri_plugin_opener::init())\n+        .plugin(tauri_plugin_sql::Builder::default().build())\n         .invoke_handler(tauri::generate_handler![greet])\n         .run(tauri::generate_context!())\n         .expect(\"error while running tauri application\");\n"
        }
      ],
      "preconditions": [],
      "assertions": []
    },
    {
      "id": "add-js-bindings",
      "task": "Install the JavaScript guest bindings package with the project's package manager.\n",
      "mutations": [
        {
          "command": "pnpm add @tauri-apps/plugin-sql",
          "cwd": "."
        }
      ],
      "preconditions": [],
      "assertions": []
    },
    {
      "id": "select-engine",
      "task": "Enable the SQLite driver: the plugin compiles a database engine only when its Cargo feature is enabled. The backend must build with the plugin registered.\n",
      "mutations": [
        {
          "command": "cargo add tauri-plugin-sql --features sqlite",
          "cwd": "src-tauri"
        }
      ],
      "preconditions": [],
      "assertions": [
        {
          "kind": "ipc-local",
          "command": "greet",
          "status": "pass"
        }
      ]
    },
    {
      "id": "usage-js",
      "task": "From the frontend, load `sqlite:test.db` and run an INSERT with the \"$#\" substitution syntax. The TypeScript build must stay green.\n",
      "mutations": [
        {
          "file": "src/main.ts",
          "diff": "--- a/src/main.ts\n+++ b/src/main.ts\n@@ -1,4 +1,5 @@\n import { invoke } from \"@tauri-apps/api/core\";\n+import Database from \"@tauri-apps/plugin-sql\";\n \n let greetInputEl: HTMLInputElement | null;\n let greetMsgEl: HTMLElement | null;\n@@ -12,11 +13,20 @@\n   }\n }\n \n-window.addEventListener(\"DOMContentLoaded\", () => {\n+window.addEventListener(\"DOMContentLoaded\", async () => {\n   greetInputEl = document.querySelector(\"#greet-input\");\n   greetMsgEl = document.querySelector(\"#greet-msg\");\n   document.querySelector(\"#greet-form\")?.addEventListener(\"submit\", (e) => {\n     e.preventDefault();\n     greet();\n   });\n+\n+  // The path is resolved relative to the app's config directory.\n+  const db = await Database.load(\"sqlite:test.db\");\n+\n+  // Use the \"$#\" syntax when substituting query data.\n+  await db.execute(\n+    \"INSERT into todos (id, title, status) VALUES ($1, $2, $3)\",\n+    [1, \"Try the sql plugin\", \"open\"],\n+  );\n });\n"
        }
      ],
      "preconditions": [],
      "assertions": [
        {
          "kind": "shell",
          "run": "pnpm build",
          "status": "pass"
        }
      ]
    },
    {
      "id": "add-migrations",
      "task": "Define an initial migration creating a `todos` table and register it on the plugin builder for the `sqlite:test.db` connection. The backend must keep compiling.\n",
      "mutations": [
        {
          "file": "src-tauri/src/lib.rs",
          "diff": "--- a/src-tauri/src/lib.rs\n+++ b/src-tauri/src/lib.rs\n@@ -1,3 +1,5 @@\n+use tauri_plugin_sql::{Migration, MigrationKind};\n+\n // Learn more about Tauri commands at https://tauri.app/develop/calling-rust/\n #[tauri::command]\n fn greet(name: &str) -> String {\n@@ -6,9 +8,23 @@\n \n #[cfg_attr(mobile, tauri::mobile_entry_point)]\n pub fn run() {\n+    let migrations = vec![\n+        // Define your migrations here\n+        Migration {\n+            version: 1,\n+            description: \"create_initial_tables\",\n+            sql: \"CREATE TABLE todos (id INTEGER PRIMARY KEY, title TEXT, status TEXT);\",\n+            kind: MigrationKind::Up,\n+        },\n+    ];\n+\n     tauri::Builder::default()\n         .plugin(tauri_plugin_opener::init())\n-        .plugin(tauri_plugin_sql::Builder::default().build())\n+        .plugin(\n+            tauri_plugin_sql::Builder::default()\n+                .add_migrations(\"sqlite:test.db\", migrations)\n+                .build(),\n+        )\n         .invoke_handler(tauri::generate_handler![greet])\n         .run(tauri::generate_context!())\n         .expect(\"error while running tauri application\");\n"
        }
      ],
      "preconditions": [],
      "assertions": [
        {
          "kind": "ipc-local",
          "command": "greet",
          "status": "pass"
        }
      ]
    },
    {
      "id": "add-preload",
      "task": "Apply the migrations when the app starts by preloading the database connection in `tauri.conf.json`.\n",
      "mutations": [
        {
          "file": "src-tauri/tauri.conf.json",
          "diff": "--- a/src-tauri/tauri.conf.json\n+++ b/src-tauri/tauri.conf.json\n@@ -32,5 +32,12 @@\n       \"icons/icon.icns\",\n       \"icons/icon.ico\"\n     ]\n+  },\n+  \"plugins\": {\n+    \"sql\": {\n+      \"preload\": [\n+        \"sqlite:test.db\"\n+      ]\n+    }\n   }\n }\n"
        }
      ],
      "preconditions": [],
      "assertions": []
    },
    {
      "id": "permissions",
      "task": "Let the frontend use the database: loading it from the webview must be denied before the capability grants the sql permissions and succeed after — and loading applies the migrations.\n",
      "mutations": [
        {
          "file": "src-tauri/capabilities/default.json",
          "diff": "--- a/src-tauri/capabilities/default.json\n+++ b/src-tauri/capabilities/default.json\n@@ -5,6 +5,8 @@\n   \"windows\": [\"main\"],\n   \"permissions\": [\n     \"core:default\",\n-    \"opener:default\"\n+    \"opener:default\",\n+    \"sql:default\",\n+    \"sql:allow-execute\"\n   ]\n }\n"
        }
      ],
      "preconditions": [
        {
          "kind": "ipc-acl",
          "command": "plugin:sql|load",
          "status": "pass"
        }
      ],
      "assertions": [
        {
          "kind": "ipc-acl",
          "command": "plugin:sql|load",
          "status": "pass"
        }
      ]
    }
  ]
}
